<?xml version="1.0" encoding="UTF-8"?>
<!DOCTYPE gameServer SYSTEM "game-server.dtd">
<gameServer name="ArenaCraft EU-1" version="2.4.1" region="EU">

  <motd>Benvenuto su un server &studio;!</motd>

  <network>
    <ip>192.168.1.10</ip>
    <port>25565</port>
    <maxPlayers>100</maxPlayers>
  </network>

  <gameMode>survival</gameMode>

  <plugins>
    <plugin enabled="true">AntiCheat</plugin>
    <plugin>EconomyPlus</plugin>
    <plugin enabled="false">DebugTools</plugin>
  </plugins>

  <players>
    <player id="P001" role="admin">
      <nickname>DragonSlayer</nickname>
      <level>87</level>
    </player>
    <player id="P002" role="moderator">
      <nickname>PixelQueen</nickname>
      <level>64</level>
    </player>
    <player id="P003">
      <nickname>NoobMaster69</nickname>
      <level>3</level>
    </player>
    <player id="P004">
      <nickname>SpeedHacker</nickname>
      <level>12</level>
    </player>
  </players>

  <bans>
    <ban player="P004" by="P001">
      <reason>Uso di cheat (speedhack)</reason>
    </ban>
  </bans>

</gameServer>
