<?xml version="1.0" encoding="UTF-8"?>
<!DOCTYPE gameServer SYSTEM "game-server.dtd">
<!-- Questo file è WELL-FORMED ma NON VALIDO: contiene 7 punti di errore numerati
     (l'ERRORE 6 ne racchiude due, quindi il validatore stampa 8 messaggi).
     Eseguilo con ../../validatori/valida.sh dtd server-dtd-non-valido.xml -->

<!-- ERRORE 1: manca l'attributo obbligatorio name; ERRORE 2: region non è in (EU|US|ASIA) -->
<gameServer region="AFRICA">

  <!-- ERRORE 3: gameMode dovrebbe venire DOPO network (l'ordine è rigido) -->
  <gameMode>survival</gameMode>

  <network>
    <ip>192.168.1.10</ip>
    <port>25565</port>
    <maxPlayers>100</maxPlayers>
  </network>

  <!-- ERRORE 4: <difficulty> non è dichiarato nella DTD -->
  <difficulty>hard</difficulty>

  <players>
    <player id="P001" role="admin">
      <nickname>DragonSlayer</nickname>
      <level>87</level>
    </player>
    <!-- ERRORE 5: l'ID P001 è già usato (ID deve essere univoco) -->
    <player id="P001" role="owner">
      <nickname>PixelQueen</nickname>
      <!-- ERRORE 6: role="owner" non è nell'enumerazione; manca anche <level> -->
    </player>
  </players>

  <bans>
    <!-- ERRORE 7: P999 non esiste (IDREF non risolto) -->
    <ban player="P999" by="P001">
      <reason>Spam in chat</reason>
    </ban>
  </bans>

</gameServer>
